"Address";"Tags"
"Одеська, Ананьївський, с, Долинське, провулок, Данілевского, 22";"['Region', 'County', 'LocalityType', 'Locality', 'StreetType', 'Street', 'HouseNumber']"
"Дніпропетровська, м, Кривий Ріг, вулиця, Постишева, 80, 6";"['Region', 'LocalityType', 'Locality', 'Locality', 'StreetType', 'Street', 'HouseNumber', 'Apartment']"
"Дніпропетровська, Дніпровський (Дніпропетровськи, с, Дослідне, вулиця, Наукова, 41, 60";"['Region', 'County', 'AdditionalData', 'LocalityType', 'Locality', 'StreetType', 'Street', 'HouseNumber', 'Apartment']"
"11231, Житомирська, Ємільчинський, с, Середи, вулиця, Сербівська, 2";"['PostCode', 'Region', 'County', 'LocalityType', 'Locality', 'StreetType', 'Street', 'HouseNumber']"
"Рівненська, м, Вараш (Кузнецовськ), мікрорайон, Вараш, 23, 21";"['Region', 'LocalityType', 'Locality', 'AdditionalData', 'StreetType', 'Street', 'HouseNumber', 'Apartment']"
"Одеська, м, Подільськ (Котовськ), вулиця, Армійська, 99, 13";"['Region', 'LocalityType', 'Locality', 'AdditionalData', 'StreetType', 'Street', 'HouseNumber', 'Apartment']"
"Херсонська, Каховський, с, Роздольне, вулиця, Сафонова, 3, 30";"['Region', 'County', 'LocalityType', 'Locality', 'StreetType', 'Street', 'HouseNumber', 'Apartment']"
"Харківська, Чугуївський, смт, Введенка, вулиця, Кірова, 182";"['Region', 'County', 'LocalityType', 'Locality', 'StreetType', 'Street', 'HouseNumber']"
"30500, Хмельницька, Полонський, м, Полонне, вулиця, Лесі Українки, 156, 3";"['PostCode', 'Region', 'SubLocality', 'LocalityType', 'Locality', 'StreetType', 'Street', 'Street', 'HouseNumber', 'Apartment']"
"Дніпропетровська, м, Кривий Ріг, вулиця, Каштанова, 50, 16";"['Region', 'LocalityType', 'Locality', 'Locality', 'StreetType', 'Street', 'HouseNumber', 'Apartment']"
"Львівська, Жидачівський, с, Городищенське, вулиця, Зарічна, 9";"['Region', 'County', 'LocalityType', 'Locality', 'StreetType', 'Street', 'HouseNumber']"
"Миколаївська, м, Миколаїв, вулиця, Молодогвардійська, 32, 3";"['Region', 'LocalityType', 'Locality', 'StreetType', 'Street', 'HouseNumber', 'Apartment']"
"Запорізька, Кам’янсько-Дніпровський, с, Благовіщенка, вулиця, Молодіжна, 5";"['Region', 'County', 'LocalityType', 'Locality', 'StreetType', 'Street', 'HouseNumber']"
"Хмельницька, м, Хмельницький, вулиця, Зарічанська, 22/1, 3";"['Region', 'LocalityType', 'Locality', 'StreetType', 'Street', 'HouseNumber', 'Apartment']"
"Запорізька, Михайлівський, смт, Пришиб, провулок, Радісний, 14";"['Region', 'County', 'LocalityType', 'Locality', 'StreetType', 'Street', 'HouseNumber']"
"84500, Донецька, м, Бахмут (Артемівськ), провулок, Харківський, 13";"['PostCode', 'Region', 'LocalityType', 'Locality', 'AdditionalData', 'StreetType', 'Street', 'HouseNumber']"
"Чернігівська, м, Прилуки, вулиця, Миколаївська, 87/1";"['Region', 'LocalityType', 'Locality', 'StreetType', 'Street', 'HouseNumber']"
"Полтавська, Хорольський, с, Куторжиха, вулиця, Гагаріна, 17";"['Region', 'County', 'LocalityType', 'Locality', 'StreetType', 'Street', 'HouseNumber']"
"72318, Запорізька, м, Мелітополь, вулиця, Олександра Невського, 81";"['PostCode', 'Region', 'LocalityType', 'Locality', 'StreetType', 'Street', 'Street', 'HouseNumber']"
"69000, Запорізька, м, Запоріжжя, вулиця, Левановского, 5, 27";"['PostCode', 'Region', 'LocalityType', 'Locality', 'StreetType', 'Street', 'HouseNumber', 'Apartment']"
"Миколаївська, Арбузинський, с, Благодатне, вулиця, Енгельса, 56";"['Region', 'County', 'LocalityType', 'Locality', 'StreetType', 'Street', 'HouseNumber']"
"Запорізька, Пологівський, с, Федорівка (Чубарівка), вулиця, Суворова, 80";"['Region', 'County', 'LocalityType', 'Locality', 'AdditionalData', 'StreetType', 'Street', 'HouseNumber']"
"Запорізька, Пологівський, м, Пологи, вулиця, Єдності, 43 А, 6";"['Region', 'SubLocality', 'LocalityType', 'Locality', 'StreetType', 'Street', 'HouseNumber', 'HouseNumberAdditionally', 'Apartment']"
"87500, Донецька, м, Маріуполь, вулиця, Будівельників, 160, 166";"['PostCode', 'Region', 'LocalityType', 'Locality', 'StreetType', 'Street', 'HouseNumber', 'Apartment']"
"36000, Кіровоградська, Долинський, с, Гурівка, вулиця, Леніна, 15";"['PostCode', 'Region', 'County', 'LocalityType', 'Locality', 'StreetType', 'Street', 'HouseNumber']"
"36000, Полтавська, Полтавський, с, Горбанівка, провулок, Польова, 2";"['PostCode', 'Region', 'County', 'LocalityType', 'Locality', 'StreetType', 'Street', 'HouseNumber']"
"Харківська, Харківський, м, Мерефа, вулиця, Українська, 37, а";"['Region', 'SubLocality', 'LocalityType', 'Locality', 'StreetType', 'Street', 'HouseNumber', 'HouseNumberAdditionally']"
"Дніпропетровська, м, Дніпро (Дніпропетровськ), проспект, О.Поля, 129Б, 128";"['Region', 'LocalityType', 'Locality', 'AdditionalData', 'StreetType', 'Street', 'HouseNumber', 'Apartment']"
"Харківська, м, Ізюм, вулиця, Лінійна, 25";"['Region', 'LocalityType', 'Locality', 'StreetType', 'Street', 'HouseNumber']"
"50000, Дніпропетровська, м, Кривий Ріг, вулиця, Адмірала Головка, 65, 64";"['PostCode', 'Region', 'LocalityType', 'Locality', 'Locality', 'StreetType', 'Street', 'Street', 'HouseNumber', 'Apartment']"
"66523, Одеська, Любашівський, с, Іванівка, вулиця, Садова, 32";"['PostCode', 'Region', 'County', 'LocalityType', 'Locality', 'StreetType', 'Street', 'HouseNumber']"
"Дніпропетровська, П’ятихатський, м, П’ятихатки, вулиця, Київська, 99";"['Region', 'SubLocality', 'LocalityType', 'Locality', 'StreetType', 'Street', 'HouseNumber']"
"Дніпропетровська, П’ятихатський, м, П’ятихатки, вулиця, Гагаріна, 233";"['Region', 'SubLocality', 'LocalityType', 'Locality', 'StreetType', 'Street', 'HouseNumber']"
"Кіровоградська, м, Кропивницький (Кіровоград), провулок, Артеллерійський, 18";"['Region', 'LocalityType', 'Locality', 'AdditionalData', 'StreetType', 'Street', 'HouseNumber']"
"Запорізька, Кам’янсько-Дніпровський, м, Кам’янка-Дніпровська, вулиця, Жовтнева, 119";"['Region', 'SubLocality', 'LocalityType', 'Locality', 'StreetType', 'Street', 'HouseNumber']"
"Київ, м, Київ, провулок, Биковський, 9, 18";"['Region', 'LocalityType', 'Locality', 'StreetType', 'Street', 'HouseNumber', 'Apartment']"
"23055, Вінницька, Барський, с, Шевченкове, вулиця, Зарічна, 17";"['PostCode', 'Region', 'County', 'LocalityType', 'Locality', 'StreetType', 'Street', 'HouseNumber']"
"21000, Вінницька, м, Вінниця, вулиця, Пирогова, 144, 88";"['PostCode', 'Region', 'LocalityType', 'Locality', 'StreetType', 'Street', 'HouseNumber', 'Apartment']"
"Сумська, Кролевецький, м, Кролевець, вулиця, Мічуріна, 48";"['Region', 'SubLocality', 'LocalityType', 'Locality', 'StreetType', 'Street', 'HouseNumber']"
"Хмельницька, м, Хмельницький, вулиця, Тернопільська, 42, гурт";"['Region', 'LocalityType', 'Locality', 'StreetType', 'Street', 'HouseNumber', 'HostelType']"
"Хмельницька, Шепетівський, с, Хутір, вулиця, Лісна, 47";"['Region', 'County', 'LocalityType', 'Locality', 'StreetType', 'Street', 'HouseNumber']"
"Полтавська, Козельщинський, с, Шевченки, вулиця, Виноградна, 15";"['Region', 'County', 'LocalityType', 'Locality', 'StreetType', 'Street', 'HouseNumber']"
"Запорізька, м, Запоріжжя, вулиця, Космічна, 131, 0";"['Region', 'LocalityType', 'Locality', 'StreetType', 'Street', 'HouseNumber', 'Apartment']"
"Полтавська, м, Полтава, бульвар, Щепотьєва, 5, 72";"['Region', 'LocalityType', 'Locality', 'StreetType', 'Street', 'HouseNumber', 'Apartment']"
"Вінницька, Іллінецький, с, Сорока, вулиця, Вишнева, 37";"['Region', 'County', 'LocalityType', 'Locality', 'StreetType', 'Street', 'HouseNumber']"
"Полтавська, Новосанжарський,, Нові Санжари, вулиця, Пятенка, 31";"['Region', 'County', 'Locality', 'Locality', 'StreetType', 'Street', 'HouseNumber']"
"Одеська, м, Ізмаїл, вулиця, Кафедральна, 10";"['Region', 'LocalityType', 'Locality', 'StreetType', 'Street', 'HouseNumber']"
"Одеська, м, Ізмаїл, вулиця, Перемоги, 71, 57";"['Region', 'LocalityType', 'Locality', 'StreetType', 'Street', 'HouseNumber', 'Apartment']"
"Вінницька, м, Вінниця, вулиця, Олега Антонова, 48А, 25";"['Region', 'LocalityType', 'Locality', 'StreetType', 'Street', 'Street', 'HouseNumber', 'Apartment']"
"19825, Черкаська, Драбівський, с, Свічківка, вулиця, Незалежності, 4";"['PostCode', 'Region', 'County', 'LocalityType', 'Locality', 'StreetType', 'Street', 'HouseNumber']"
"Київ, м, Київ, вулиця, Ахматової, 13-г, 77";"['Region', 'LocalityType', 'Locality', 'StreetType', 'Street', 'HouseNumber', 'Apartment']"
"Київська, Ірпінь, смт, Ворзель, вулиця, Ватутіна, 8";"['Region', 'County', 'LocalityType', 'Locality', 'StreetType', 'Street', 'HouseNumber']"
"Житомирська, м, Коростень, провулок, 1 Шатрищанський, 26А, 2";"['Region', 'LocalityType', 'Locality', 'StreetType', 'Street', 'Street', 'HouseNumber', 'Apartment']"
"Чернігівська, Бахмацький,, Обмачів, вулиця, Л Українки, 49";"['Region', 'County', 'Locality', 'StreetType', 'Street', 'Street', 'HouseNumber']"
"Чернігівська, Бахмацький,, Обмачів, вулиця, Польова, 57";"['Region', 'County', 'Locality', 'StreetType', 'Street', 'HouseNumber']"
"Хмельницька, Дунаєвецький, с, Балин, вулиця, Циганівська, 23";"['Region', 'County', 'LocalityType', 'Locality', 'StreetType', 'Street', 'HouseNumber']"
"Сумська, м, Конотоп, вулиця, Будівельників, 24, 22";"['Region', 'LocalityType', 'Locality', 'StreetType', 'Street', 'HouseNumber', 'Apartment']"
"Київ, м, Київ, вулиця, Здолбунівська, 3б, 187";"['Region', 'LocalityType', 'Locality', 'StreetType', 'Street', 'HouseNumber', 'Apartment']"
"Кіровоградська, Устинівський, смт, Устинівка, вулиця, Поштова, 2";"['Region', 'County', 'LocalityType', 'Locality', 'StreetType', 'Street', 'HouseNumber']"
"Дніпропетровська, м, Дніпро (Дніпропетровськ), вулиця, Докучаєва, 33, 54";"['Region', 'LocalityType', 'Locality', 'AdditionalData', 'StreetType', 'Street', 'HouseNumber', 'Apartment']"
"Волинська, м, Володимир-Волинський, вулиця, Дверницького, 11";"['Region', 'LocalityType', 'Locality', 'StreetType', 'Street', 'HouseNumber']"
"Житомирська, Любарський, с, Привітів, вулиця, Польова, 9";"['Region', 'County', 'LocalityType', 'Locality', 'StreetType', 'Street', 'HouseNumber']"
"Вінницька, Тиврівський,, Василівка, вулиця, Шевченка, 16";"['Region', 'County', 'Locality', 'StreetType', 'Street', 'HouseNumber']"
"65000, Одеська, Захарівський (Фрунзівський), с, Новозаріцьке, вулиця, Полева, 1";"['PostCode', 'Region', 'County', 'AdditionalData', 'LocalityType', 'Locality', 'StreetType', 'Street', 'HouseNumber']"
"65000, Одеська, м, Одеса, вулиця, Ізвісткова, 22 а";"['PostCode', 'Region', 'LocalityType', 'Locality', 'StreetType', 'Street', 'HouseNumber', 'HouseNumberAdditionally']"
"Херсонська, Каланчацький, смт, Каланчак, вулиця, Гагаріна, 22";"['Region', 'County', 'LocalityType', 'Locality', 'StreetType', 'Street', 'HouseNumber']"
"Миколаївська, Доманівський, с, Кузнецове, вулиця, Чкалова, 7";"['Region', 'County', 'LocalityType', 'Locality', 'StreetType', 'Street', 'HouseNumber']"
"Миколаївська, Доманівський, с, Маринівка, вулиця, Киртка, 106";"['Region', 'County', 'LocalityType', 'Locality', 'StreetType', 'Street', 'HouseNumber']"
"Херсонська, Генічеський, смт, Рикове (Партизани), вулиця, Петровського, 46";"['Region', 'County', 'LocalityType', 'Locality', 'AdditionalData', 'StreetType', 'Street', 'HouseNumber']"
"Херсонська, Генічеський, с, Рівне, вулиця, Молодіжна, 63";"['Region', 'County', 'LocalityType', 'Locality', 'StreetType', 'Street', 'HouseNumber']"
"61000, Харківська, Харківський, м, Мерефа, в’їзд, Кобзяра, 8";"['PostCode', 'Region', 'SubLocality', 'LocalityType', 'Locality', 'StreetType', 'Street', 'HouseNumber']"
"Черкаська, Корсунь-Шевченківський,, Заріччя, вулиця, Парламентерів, 73";"['Region', 'County', 'Locality', 'StreetType', 'Street', 'HouseNumber']"
"Черкаська, Корсунь-Шевченківський,, Заріччя, вулиця, Фонтанська, 10";"['Region', 'County', 'Locality', 'StreetType', 'Street', 'HouseNumber']"
"Чернігівська, Бахмацький, м, Бахмач, вулиця, Кожедуба, 10";"['Region', 'SubLocality', 'LocalityType', 'Locality', 'StreetType', 'Street', 'HouseNumber']"
"Чернігівська, Бахмацький, м, Бахмач, вулиця, Мирна, 35";"['Region', 'SubLocality', 'LocalityType', 'Locality', 'StreetType', 'Street', 'HouseNumber']"
"Вінницька, Літинський, с, Бруслинів, вулиця, Жовтнева, 64";"['Region', 'County', 'LocalityType', 'Locality', 'StreetType', 'Street', 'HouseNumber']"
"Волинська, Горохівський, с, Цегів, вулиця, Шевченка, 17";"['Region', 'County', 'LocalityType', 'Locality', 'StreetType', 'Street', 'HouseNumber']"
"Одеська, Ізмаїльський, смт, Суворове, вулиця, Перемоги, 31";"['Region', 'County', 'LocalityType', 'Locality', 'StreetType', 'Street', 'HouseNumber']"
"Івано-Франківська, Верховинський, с, Полянки, вулиця, Центральна";"['Region', 'County', 'LocalityType', 'Locality', 'StreetType', 'Street']"
"Черкаська, Шполянський, с, Лебедин, вулиця, Перемоги, 162";"['Region', 'County', 'LocalityType', 'Locality', 'StreetType', 'Street', 'HouseNumber']"
"Луганська, Кремінський, м, Кремінна, вулиця, Побєди, 6, 15";"['Region', 'SubLocality', 'LocalityType', 'Locality', 'StreetType', 'Street', 'HouseNumber', 'Apartment']"
"Запорізька, Кам’янсько-Дніпровський, м, Кам’янка-Дніпровська, вулиця, Радянська, 158";"['Region', 'SubLocality', 'LocalityType', 'Locality', 'StreetType', 'Street', 'HouseNumber']"
"Запорізька, Кам’янсько-Дніпровський, м, Кам’янка-Дніпровська, вулиця, Промислова, 18, 2";"['Region', 'SubLocality', 'LocalityType', 'Locality', 'StreetType', 'Street', 'HouseNumber', 'Apartment']"
"Дніпропетровська, Васильківський, смт, Васильківка, вулиця, Каштанова, 21";"['Region', 'County', 'LocalityType', 'Locality', 'StreetType', 'Street', 'HouseNumber']"
"Кіровоградська, Устинівський, с, Ганно-Леонтовичеве, вулиця, Миру, 41";"['Region', 'County', 'LocalityType', 'Locality', 'StreetType', 'Street', 'HouseNumber']"
"Кіровоградська, Устинівський, с, Ганно-Леонтовичеве, вулиця, Миру, 39";"['Region', 'County', 'LocalityType', 'Locality', 'StreetType', 'Street', 'HouseNumber']"
"Запорізька, Великобілозерський, с, Велика Білозерка, вулиця, Радянська, 86";"['Region', 'County', 'LocalityType', 'Locality', 'Locality', 'StreetType', 'Street', 'HouseNumber']"
"Сумська, Конотопський, Т Дубов’язівка, вулиця Професійна, 54";"['Region', 'County', 'Locality', 'Locality', 'StreetType', 'Street', 'HouseNumber']"
"Харківська, м, Харків, вулиця, Сочинська, 73, 20";"['Region', 'LocalityType', 'Locality', 'StreetType', 'Street', 'HouseNumber', 'Apartment']"
"Луганська, Марківський, с, Марківське, вулиця, Пушкіна, 54";"['Region', 'County', 'LocalityType', 'Locality', 'StreetType', 'Street', 'HouseNumber']"
"Чернігівська, Менський, с, Дягова, вулиця, Широка, 55";"['Region', 'County', 'LocalityType', 'Locality', 'StreetType', 'Street', 'HouseNumber']"
"Кіровоградська, Світловодський, С Миронівка, вулиця Шевченка, 9";"['Region', 'County', 'LocalityType', 'Locality', 'StreetType', 'Street', 'HouseNumber']"
"Рівненська, Здолбунівський, С Йосипівка, вулиця Гора, 8";"['Region', 'County', 'LocalityType', 'Locality', 'StreetType', 'Street', 'HouseNumber']"
"Рівненська, Костопільський, С Іваничі, вулиця Л.Савчука, 22";"['Region', 'County', 'LocalityType', 'Locality', 'StreetType', 'Street', 'HouseNumber']"
"Рівненська, Костопільський, С Іваничі, вулиця Костопільська, 45";"['Region', 'County', 'LocalityType', 'Locality', 'StreetType', 'Street', 'HouseNumber']"
"Харківська, м, Харків, вулиця, Бучми, 44, 47";"['Region', 'LocalityType', 'Locality', 'StreetType', 'Street', 'HouseNumber', 'Apartment']"
"Вінницька, м, Ладижин, вулиця, Будівельників, 50, 51";"['Region', 'LocalityType', 'Locality', 'StreetType', 'Street', 'HouseNumber', 'Apartment']"
"Дніпропетровська, Петропавлівський, смт, Петропавлівка, вулиця, Кірова, 89а";"['Region', 'County', 'LocalityType', 'Locality', 'StreetType', 'Street', 'HouseNumber']"
"Житомирська, Овруцький, с, Словечне, вулиця, Механізації, 33";"['Region', 'County', 'LocalityType', 'Locality', 'StreetType', 'Street', 'HouseNumber']"
"Київ, м, Київ, площа, Дружби Народів, 2, а, 79";"['Region', 'LocalityType', 'Locality', 'StreetType', 'Street', 'Street', 'HouseNumber', 'HouseNumberAdditionally', 'Apartment']"
"Київ, м, Київ, бульвар, Дарницький, 10а, 53";"['Region', 'LocalityType', 'Locality', 'StreetType', 'Street', 'HouseNumber', 'Apartment']"
"48711, Тернопільська, Борщівський, С Озеряни, вулиця Зелена, 1";"['PostCode', 'Region', 'County', 'LocalityType', 'Locality', 'StreetType', 'Street', 'HouseNumber']"
"Київ, М Київ, проспект Ак.Глушкова, 29, 5";"['Region', 'LocalityType', 'Locality', 'StreetType', 'Street', 'HouseNumber', 'Apartment']"
"Дніпропетровська, Покровський, с, Катеринівка, вулиця, Гагаріна, 37";"['Region', 'County', 'LocalityType', 'Locality', 'StreetType', 'Street', 'HouseNumber']"
"Кіровоградська, Добровеличківський, с, Тишківка, вулиця, Лермонтова, 50";"['Region', 'County', 'LocalityType', 'Locality', 'StreetType', 'Street', 'HouseNumber']"
"20355, Черкаська, Уманський, С Оксанина, вулиця Шевченка, 46";"['PostCode', 'Region', 'County', 'LocalityType', 'Locality', 'StreetType', 'Street', 'HouseNumber']"
"20935, Черкаська, Чигиринський, с, Полуднівка, вулиця, Дорошенка, 10";"['PostCode', 'Region', 'County', 'LocalityType', 'Locality', 'StreetType', 'Street', 'HouseNumber']"
"Вінницька, Тростянецький, Т Тростянець, вулиця Макаренка, 4";"['Region', 'County', 'Locality', 'Locality', 'StreetType', 'Street', 'HouseNumber']"
"Львівська, Сокальський, м, Сокаль, вулиця, Героїв УПА, 27, 34";"['Region', 'SubLocality', 'LocalityType', 'Locality', 'StreetType', 'Street', 'Street', 'HouseNumber', 'Apartment']"
"Сумська, Білопільський, м, Білопілля, вулиця, Олеся, 52";"['Region', 'SubLocality', 'LocalityType', 'Locality', 'StreetType', 'Street', 'HouseNumber']"
"Київ, м, Київ, бульвар, Кольцова, 3б, 38";"['Region', 'LocalityType', 'Locality', 'StreetType', 'Street', 'HouseNumber', 'Apartment']"
"Чернігівська, Носівський, м, Носівка, вулиця, Польова, 15";"['Region', 'SubLocality', 'LocalityType', 'Locality', 'StreetType', 'Street', 'HouseNumber']"
"30224, Хмельницька, Білогірський, С Сивки, вулиця Польова, 16";"['PostCode', 'Region', 'County', 'LocalityType', 'Locality', 'StreetType', 'Street', 'HouseNumber']"
"36521, Харківська, Чугуївський, С Тернова, вулиця Радянська, 8 7";"['PostCode', 'Region', 'County', 'LocalityType', 'Locality', 'StreetType', 'Street', 'HouseNumber', 'Apartment']"
"51032, Дніпропетровська, Царичанський, С Плавещина, вулиця Пушкіна, 34";"['PostCode', 'Region', 'County', 'LocalityType', 'Locality', 'StreetType', 'Street', 'HouseNumber']"
"Запорізька, м, Бердянськ, вулиця, Баха, 40, 20";"['Region', 'LocalityType', 'Locality', 'StreetType', 'Street', 'HouseNumber', 'Apartment']"
"Миколаївська, Первомайський, с, Кам’яний Міст, вулиця, Набережна, 47";"['Region', 'County', 'LocalityType', 'Locality', 'Locality', 'StreetType', 'Street', 'HouseNumber']"
"34500, Рівненська, Сарненський, с, Ремчиці, вулиця, Перемоги, 10, 1";"['PostCode', 'Region', 'County', 'LocalityType', 'Locality', 'StreetType', 'Street', 'HouseNumber', 'Apartment']"
"Сумська, Липоводолинський, смт, Липова Долина, вулиця, Лісова, 29";"['Region', 'County', 'LocalityType', 'Locality', 'Locality', 'StreetType', 'Street', 'HouseNumber']"
"Сумська, Липоводолинський, смт, Липова Долина, вулиця, Благовіщенська, 30, 1";"['Region', 'County', 'LocalityType', 'Locality', 'Locality', 'StreetType', 'Street', 'HouseNumber', 'Apartment']"
"Київ, м, Київ, вулиця, Бикова, 6, 132";"['Region', 'LocalityType', 'Locality', 'StreetType', 'Street', 'HouseNumber', 'Apartment']"
"Дніпропетровська, М Жовті Води, вулиця Заводська, 16, 59";"['Region', 'LocalityType', 'Locality', 'Locality', 'StreetType', 'Street', 'HouseNumber', 'Apartment']"
"Київська, м, Фастів, вулиця, Червоноармійська, 40, 26";"['Region', 'LocalityType', 'Locality', 'StreetType', 'Street', 'HouseNumber', 'Apartment']"
"Хмельницька, м, Хмельницький, вулиця, Козацька, 65/1, 26";"['Region', 'LocalityType', 'Locality', 'StreetType', 'Street', 'HouseNumber', 'Apartment']"
"Київ, м, Київ, вулиця, Виборзька, 34/36, 9";"['Region', 'LocalityType', 'Locality', 'StreetType', 'Street', 'HouseNumber', 'Apartment']"
"Дніпропетровська, м, Кам’янське (Дніпродзержинськ), вулиця, Алтайська, 3, 20";"['Region', 'LocalityType', 'Locality', 'AdditionalData', 'StreetType', 'Street', 'HouseNumber', 'Apartment']"
